<!ELEMENT cartelera (actor*, pelicula*)>
<!ELEMENT actor (#PCDATA)>
<!ATTLIST actor cod ID #REQUIRED>

<!ELEMENT pelicula (#PCDATA)>
<!ATTLIST pelicula actores IDREFS #REQUIRED>
